source,url,company,title,role_cluster,location_remote_start,industry,main_tasks,work_pattern,tools_systems,must_skills,nice_to_have,already_have,gap_blocking,gap_learnable,gap_bonus,experience_required,entry_realistic,growth_value,interest,decision,priority,application_deadline,next_action,notes,tags,date_posted
demo-stat,https://example.org/jobs/statistics-data-analyst,StatLab Demo,Junior Statistical Data Analyst,Statistics / Data Analysis,Deutschland / Remote / flexibel,Forschung / Analyse,"Umfragedaten auswerten; deskriptive Statistik berechnen; Ergebnisse dokumentieren","Statistik; Reporting; Datenprüfung","RStudio; SPSS; Excel; CSV","Statistik; Datenanalyse; sorgfältige Dokumentation","SQL; Python; Power BI","Statistik; SPSS; RStudio; Reporting","Business-Kontext könnte fehlen","SQL-Übungen; Power-BI-Dashboard bauen","Data Storytelling","Junior / Einstieg",Ja,Hoch,Hoch,bewerben,hoch,2026-07-18,Statistik-Projekt als Arbeitsprobe vorbereiten,"Sehr passend für Statistikprofil.",statistics; statistik; spss; rstudio; reporting,2026-06-20
demo-stat,https://example.org/jobs/reporting-analyst-junior,Northwind Analytics,Junior Reporting Analyst,Reporting / Business Intelligence,Hamburg / Hybrid / ab sofort,Business Intelligence,"Kennzahlen pflegen; Reports aktualisieren; Datenqualität prüfen","Reporting; Abstimmung; Datenpflege","Power BI; Excel; SQL","Reporting; Excel; analytisches Denken","Power BI; SQL; Datenmodellierung","Reporting; Statistik; Datenanalyse","BI-Erfahrung könnte begrenzt sein","Power BI vertiefen; SQL-Aggregationen üben","Stakeholder-Kommunikation","Junior geeignet",Ja,Hoch,Hoch,bewerben,hoch,,Power-BI-Demo ergänzen,"Guter Übergang von Statistik zu BI.",reporting; power bi; sql; data analysis,2026-06-21
demo-stat,https://example.org/jobs/research-data-analyst,Example Research Institute,Research Data Analyst,Research Data / Statistics,Remote / Teilzeit oder Vollzeit,Forschung / Evaluation,"Forschungsdaten bereinigen; Auswertungen dokumentieren; Tabellen und Diagramme erstellen","Analyse; Dokumentation; Qualitätssicherung","RStudio; SPSS; CSV; Markdown","Statistik; quantitative Methoden; Dokumentation","Python; Open Science; GitHub","Datenanalyse; Reporting; Markdown","Forschungsdomäne muss verstanden werden","Open-Science-Workflows; GitHub Pages","Publikationsnahe Datenarbeit","Einstieg realistisch",Ja,Hoch,Hoch,bewerben,mittel,2026-08-01,Methodenbericht vorbereiten,"Sehr gut für Statistik und Dokumentation.",research; statistics; markdown; data quality,2026-06-22
demo-stat,https://example.org/jobs/data-quality-statistics,Demo Quality Analytics,Data Quality Analyst Statistik,Data Quality / Statistical QA,Deutschland / Hybrid,Datenqualität / Qualitätskontrolle,"Ausreißer prüfen; Plausibilitätsregeln dokumentieren; Qualitätsberichte erstellen","Datenprüfung; Regelwerk; Reporting","SQL; Excel; Python; CSV","Datenqualität; Statistik; Plausibilitätsprüfung","Python pandas; SQL","Statistik; CSV; Qualitätsregeln","Python-Praxis könnte begrenzt sein","pandas-Grundlagen; SQL-Filter","Automatisierte Checks","Junior bis erste Erfahrung",Ja,Hoch,Hoch,bewerben,hoch,,pandas-Minicheck bauen,"Sehr passend: Statistik plus Datenqualität.",data quality; statistik; python; sql; csv,2026-06-23
demo-stat,https://example.org/jobs/quantitative-research-assistant,Demo Policy Lab,Quantitative Research Assistant,Quantitative Research,Hamburg / Hybrid,Policy / Forschung,"Daten recherchieren; quantitative Analysen unterstützen; Ergebnisse visualisieren","Recherche; Statistik; Berichtswesen","SPSS; Excel; RStudio","quantitative Methoden; Recherche; Ergebnisdokumentation","Power BI; wissenschaftliches Schreiben","Statistik; Recherche; Reporting","befristetes Projekt möglich","Policy-Kontext einarbeiten","Survey Methodology","Einstieg realistisch",Vielleicht,Mittel,Hoch,beobachten,mittel,2026-07-30,Projektbefristung prüfen,"Fachlich passend, Rahmenbedingungen klären.",quantitative analysis; research; spss; reporting,2026-06-24
demo-stat,https://example.org/jobs/business-data-analyst-senior,Example Enterprise Analytics,Senior Business Data Analyst,Business Analytics,Berlin / vor Ort,Enterprise Analytics,"Business KPIs verantworten; Data Strategy beraten; Senior-Stakeholder führen","Analytics; Consulting; Ownership","SQL; Power BI; Snowflake","5+ Jahre Erfahrung; Stakeholderführung; BI-Architektur","Data Strategy","Reporting-Grundlagen","Senior-Level blockiert","Enterprise-BI wäre lernbar","Strategiearbeit","Senior",Nein,Niedrig,Niedrig,ablehnen,niedrig,,Nicht priorisieren,"Negativbeispiel für Statistikdemo.",senior; reporting; power bi; 5+ years,2026-06-25
demo-stat,https://example.org/jobs/data-entry-clerk,Example Office Services,Data Entry Clerk,Data Entry,Hamburg / vor Ort,Administration,"Daten abtippen; Listen aktualisieren; einfache Kontrollen","Routine; Dateneingabe","Excel","Sorgfalt; Verfügbarkeit","Grundlagen Datenqualität","Tabellenarbeit","fachlicher Analyseanteil fehlt","Excel-Shortcuts","Büroprozesse","Einstieg möglich",Nein,Niedrig,Niedrig,ablehnen,niedrig,,Nicht passend,"Zu wenig Statistik/Analyse.",data entry; excel,2026-06-26
demo-stat,https://example.org/jobs/sales-analyst-trainee,Demo Growth Sales,Sales Analyst Trainee,Sales Analytics,Hamburg / vor Ort,Sales,"Sales KPIs auswerten; Vertriebskampagnen unterstützen; Leads priorisieren","Reporting; Vertrieb; CRM","CRM; Excel; Power BI","Reporting; Sales-Affinität","SQL; Statistik","Reporting; Power BI","starker Sales-Fokus könnte stören","CRM lernen; Sales-KPIs verstehen","Revenue Operations","Trainee",Vielleicht,Mittel,Mittel,beobachten,niedrig,,Sales-Anteil kritisch prüfen,"Grenzfall: Analyse, aber Sales-Fokus.",sales; reporting; power bi; crm,2026-06-27
